"DESCRIPTION","DURATION IN MS","NAME","PARENT SUITE","START TIME","STATUS","STOP TIME","SUB SUITE","SUITE","TEST CLASS","TEST METHOD"
"","3066","Failed login with invalid credentials (example #2)","","Sun Feb 08 05:20:19 UTC 2026","passed","Sun Feb 08 05:20:22 UTC 2026","","User Authentication","",""
"","8296","Successful login with valid credentials","","Sun Feb 08 05:20:05 UTC 2026","passed","Sun Feb 08 05:20:13 UTC 2026","","User Authentication","",""
"","1765","Failed login with malformed email","","Sun Feb 08 05:20:14 UTC 2026","passed","Sun Feb 08 05:20:16 UTC 2026","","User Authentication","",""
"","3202","Failed login with invalid credentials (example #3)","","Sun Feb 08 05:20:22 UTC 2026","passed","Sun Feb 08 05:20:25 UTC 2026","","User Authentication","",""
"","2806","Failed login with invalid credentials (example #1)","","Sun Feb 08 05:20:16 UTC 2026","passed","Sun Feb 08 05:20:18 UTC 2026","","User Authentication","",""
